{"acceptance_sha256":"548d15927733956549a72486cdae513531dbb0c71a624fe1b0bf1b24347e48e2","config":{"core_fmt":"ternary","ctx":256,"d":96,"d_ff":400,"delta":0.5,"emb_fmt":"4bit","mlp":"gelu","n_heads":6,"n_layers":3,"qk_norm":false,"scale_policy":"row16","vocab":256},"data":{"bytes":2166391771,"path":"8745f0d0f0c2ede79305e35393f90b35ff15c91fa1d85abed2acafdf4046e092.bin","sha256":"8745f0d0f0c2ede79305e35393f90b35ff15c91fa1d85abed2acafdf4046e092"},"indices":{"bytes":913408,"chunks":[{"bytes":913408,"path":"c7e8b6fd5dd98c47d504d87717abf9ec8188b093c5f2253fe5dcfed8aa97e3f4.chunk","sha256":"c7e8b6fd5dd98c47d504d87717abf9ec8188b093c5f2253fe5dcfed8aa97e3f4"}],"path":"c7e8b6fd5dd98c47d504d87717abf9ec8188b093c5f2253fe5dcfed8aa97e3f4.bin","sha256":"c7e8b6fd5dd98c47d504d87717abf9ec8188b093c5f2253fe5dcfed8aa97e3f4"},"initialization":{"bytes":9473621,"chunks":[{"bytes":2097152,"path":"dab40f940dbcfe78e95a8f586531ffe9b01deaa010806798e8a0ed7f3fb3c2e2.chunk","sha256":"dab40f940dbcfe78e95a8f586531ffe9b01deaa010806798e8a0ed7f3fb3c2e2"},{"bytes":2097152,"path":"786e7a7378af643ea25781f25de32df97720a5f20c0fc0f43e03b6d49a977106.chunk","sha256":"786e7a7378af643ea25781f25de32df97720a5f20c0fc0f43e03b6d49a977106"},{"bytes":2097152,"path":"7be628dd9d96baa98126b3ad1250140a526d9e4ef88781de3f1a6940775a6604.chunk","sha256":"7be628dd9d96baa98126b3ad1250140a526d9e4ef88781de3f1a6940775a6604"},{"bytes":2097152,"path":"7bfc57729ea3a5f61e54280f171264ec113fb441fca4f8eb9b9c72bc4caa484f.chunk","sha256":"7bfc57729ea3a5f61e54280f171264ec113fb441fca4f8eb9b9c72bc4caa484f"},{"bytes":1085013,"path":"f8fcd237f8bf90be40f90a1aec7d4c01966e0de7eeb35b46f88385c5cf3d47e6.chunk","sha256":"f8fcd237f8bf90be40f90a1aec7d4c01966e0de7eeb35b46f88385c5cf3d47e6"}],"path":"9fcfd63a9adfaaedca26eb97f97cde0e70f7a6d2c82c11c77bd433fb4cf42c15.bin","sha256":"9fcfd63a9adfaaedca26eb97f97cde0e70f7a6d2c82c11c77bd433fb4cf42c15"},"job_id":"e0-20261001T090514Z-4236fd-000-repair","purpose":"scientific","schema":"floppylm.e0.job.v1","spec":{"batch":32,"branches":3,"cooldown_frac":0.1,"lr":0.003,"seed":0,"tokens":7311360,"warmup_frac":0.02,"wd":0.1}}
