{"config":{"core_fmt":"ternary","ctx":8,"d":8,"d_ff":8,"delta":0.5,"emb_fmt":"4bit","mlp":"gelu","n_heads":2,"n_layers":1,"qk_norm":false,"scale_policy":"row16","vocab":256},"data":{"bytes":1024,"path":"train.bin","sha256":"785b0751fc2c53dc14a4ce3d800e69ef9ce1009eb327ccf458afe09c242c26c9"},"indices":{"bytes":256,"path":"indices.bin","sha256":"34fc824ad99120fdec690834a99fd7e012d2d30d81823042c3b2f7cc601b87be"},"initialization":{"bytes":62396,"path":"initial.json","sha256":"df56cba3eb227f99557482769c8212a88cc9fee9d6c30d7dc3df8ffc38d03bb1"},"job_id":"tiny","purpose":"functional","runtime_fault_probe":{"after_checkpoint_step":1,"kind":"published_fence_stall"},"schema":"floppylm.e0.job.v1","spec":{"batch":2,"branches":3,"cooldown_frac":0.1,"lr":0.003,"seed":0,"tokens":64,"warmup_frac":0.02,"wd":0.1}}
