{"config":{"core_fmt":"ternary","ctx":8,"d":32,"d_ff":48,"delta":0.5,"emb_fmt":"4bit","mlp":"gelu","n_heads":2,"n_layers":1,"qk_norm":false,"scale_policy":"row16","vocab":256},"data":{"bytes":2400,"path":"5cfad374551fe321af98e324590e025a9fc9ef48c80a4283b75fed19e1af8e06.bin","sha256":"5cfad374551fe321af98e324590e025a9fc9ef48c80a4283b75fed19e1af8e06"},"indices":{"bytes":512,"path":"8962b2891667ac1cfff64094b4b8acb550ffbe88b81d0c4ea5e05766bf773c2b.bin","sha256":"8962b2891667ac1cfff64094b4b8acb550ffbe88b81d0c4ea5e05766bf773c2b"},"initialization":{"bytes":392979,"path":"f14bce8a121da67b15e33321aee85c888325632e3e7aebe26defa5fdcad6a3bd.bin","sha256":"f14bce8a121da67b15e33321aee85c888325632e3e7aebe26defa5fdcad6a3bd"},"job_id":"gate-20261001T090105Z-2c51a2-resumed","purpose":"functional","resume":{"bytes":1011776,"path":"results/gate-20261001T090105Z-2c51a2-resumed/checkpoint.json","sha256":"3203ed5e51359efd838404c1b2d755c92a5406594b879c4dcc5706d987b07e5a"},"schema":"floppylm.e0.job.v1","spec":{"batch":2,"branches":3,"cooldown_frac":0.1,"lr":0.003,"seed":19,"tokens":128,"warmup_frac":0.02,"wd":0.1}}
